{
  "id": "T-1",
  "title": "Implementar el alcance acordado",
  "criterionIds": [
    "AC-1"
  ],
  "agent": "pulso-executor",
  "status": "pending",
  "dependsOn": [],
  "writeScope": [
    "src/example.js"
  ],
  "resources": [],
  "acceptance": [
    "Verificar AC-1 según el contrato acordado."
  ],
  "evidenceIds": [],
  "summary": ""
}
